03:50:52.978864 IP arun-VirtualBox > arun-VirtualBox: ICMP echo request, id 8429, seq 1, length 64
03:50:52.978873 IP arun-VirtualBox > arun-VirtualBox: ICMP echo reply, id 8429, seq 1, length 64
03:50:54.008255 IP arun-VirtualBox > arun-VirtualBox: ICMP echo request, id 8429, seq 2, length 64
03:50:54.008282 IP arun-VirtualBox > arun-VirtualBox: ICMP echo reply, id 8429, seq 2, length 64
03:50:55.033024 IP arun-VirtualBox > arun-VirtualBox: ICMP echo request, id 8429, seq 3, length 64
03:50:55.033052 IP arun-VirtualBox > arun-VirtualBox: ICMP echo reply, id 8429, seq 3, length 64
03:50:56.056616 IP arun-VirtualBox > arun-VirtualBox: ICMP echo request, id 8429, seq 4, length 64
03:50:56.056644 IP arun-VirtualBox > arun-VirtualBox: ICMP echo reply, id 8429, seq 4, length 64
03:50:57.080627 IP arun-VirtualBox > arun-VirtualBox: ICMP echo request, id 8429, seq 5, length 64
03:50:57.080654 IP arun-VirtualBox > arun-VirtualBox: ICMP echo reply, id 8429, seq 5, length 64
03:50:58.104345 IP arun-VirtualBox > arun-VirtualBox: ICMP echo request, id 8429, seq 6, length 64
03:50:58.104372 IP arun-VirtualBox > arun-VirtualBox: ICMP echo reply, id 8429, seq 6, length 64
03:50:59.128641 IP arun-VirtualBox > arun-VirtualBox: ICMP echo request, id 8429, seq 7, length 64
03:50:59.128675 IP arun-VirtualBox > arun-VirtualBox: ICMP echo reply, id 8429, seq 7, length 64
03:51:00.151958 IP arun-VirtualBox > arun-VirtualBox: ICMP echo request, id 8429, seq 8, length 64
03:51:00.151969 IP arun-VirtualBox > arun-VirtualBox: ICMP echo reply, id 8429, seq 8, length 64
03:51:01.175974 IP arun-VirtualBox > arun-VirtualBox: ICMP echo request, id 8429, seq 9, length 64
03:51:01.175990 IP arun-VirtualBox > arun-VirtualBox: ICMP echo reply, id 8429, seq 9, length 64
03:51:02.200485 IP arun-VirtualBox > arun-VirtualBox: ICMP echo request, id 8429, seq 10, length 64
03:51:02.200514 IP arun-VirtualBox > arun-VirtualBox: ICMP echo reply, id 8429, seq 10, length 64
03:51:03.224181 IP arun-VirtualBox > arun-VirtualBox: ICMP echo request, id 8429, seq 11, length 64
03:51:03.224195 IP arun-VirtualBox > arun-VirtualBox: ICMP echo reply, id 8429, seq 11, length 64
03:51:04.248709 IP arun-VirtualBox > arun-VirtualBox: ICMP echo request, id 8429, seq 12, length 64
03:51:04.248738 IP arun-VirtualBox > arun-VirtualBox: ICMP echo reply, id 8429, seq 12, length 64
03:51:05.272571 IP arun-VirtualBox > arun-VirtualBox: ICMP echo request, id 8429, seq 13, length 64
03:51:05.272598 IP arun-VirtualBox > arun-VirtualBox: ICMP echo reply, id 8429, seq 13, length 64
03:51:06.296908 IP arun-VirtualBox > arun-VirtualBox: ICMP echo request, id 8429, seq 14, length 64
03:51:06.296919 IP arun-VirtualBox > arun-VirtualBox: ICMP echo reply, id 8429, seq 14, length 64
03:51:07.320308 IP arun-VirtualBox > arun-VirtualBox: ICMP echo request, id 8429, seq 15, length 64
03:51:07.320326 IP arun-VirtualBox > arun-VirtualBox: ICMP echo reply, id 8429, seq 15, length 64
03:51:08.344431 IP arun-VirtualBox > arun-VirtualBox: ICMP echo request, id 8429, seq 16, length 64
03:51:08.344442 IP arun-VirtualBox > arun-VirtualBox: ICMP echo reply, id 8429, seq 16, length 64
03:51:09.368681 IP arun-VirtualBox > arun-VirtualBox: ICMP echo request, id 8429, seq 17, length 64
03:51:09.368709 IP arun-VirtualBox > arun-VirtualBox: ICMP echo reply, id 8429, seq 17, length 64
03:51:10.396275 IP arun-VirtualBox > arun-VirtualBox: ICMP echo request, id 8429, seq 18, length 64
03:51:10.396360 IP arun-VirtualBox > arun-VirtualBox: ICMP echo reply, id 8429, seq 18, length 64
03:51:11.437324 IP arun-VirtualBox > arun-VirtualBox: ICMP echo request, id 8429, seq 19, length 64
03:51:11.437360 IP arun-VirtualBox > arun-VirtualBox: ICMP echo reply, id 8429, seq 19, length 64
03:51:12.484024 IP arun-VirtualBox > arun-VirtualBox: ICMP echo request, id 8429, seq 20, length 64
03:51:12.484053 IP arun-VirtualBox > arun-VirtualBox: ICMP echo reply, id 8429, seq 20, length 64
03:51:13.500134 IP arun-VirtualBox > arun-VirtualBox: ICMP echo request, id 8429, seq 21, length 64
03:51:13.500178 IP arun-VirtualBox > arun-VirtualBox: ICMP echo reply, id 8429, seq 21, length 64
03:51:28.331438 IP localhost > localhost: ICMP echo request, id 8430, seq 1, length 64
03:51:28.331446 IP localhost > localhost: ICMP echo reply, id 8430, seq 1, length 64
03:51:29.337041 IP localhost > localhost: ICMP echo request, id 8430, seq 2, length 64
03:51:29.337056 IP localhost > localhost: ICMP echo reply, id 8430, seq 2, length 64
03:51:30.368795 IP localhost > localhost: ICMP echo request, id 8430, seq 3, length 64
03:51:30.368822 IP localhost > localhost: ICMP echo reply, id 8430, seq 3, length 64
03:51:31.392115 IP localhost > localhost: ICMP echo request, id 8430, seq 4, length 64
03:51:31.392142 IP localhost > localhost: ICMP echo reply, id 8430, seq 4, length 64
03:51:32.409046 IP localhost > localhost: ICMP echo request, id 8430, seq 5, length 64
03:51:32.409072 IP localhost > localhost: ICMP echo reply, id 8430, seq 5, length 64
03:51:33.432238 IP localhost > localhost: ICMP echo request, id 8430, seq 6, length 64
03:51:33.432264 IP localhost > localhost: ICMP echo reply, id 8430, seq 6, length 64
03:51:34.456215 IP localhost > localhost: ICMP echo request, id 8430, seq 7, length 64
03:51:34.456237 IP localhost > localhost: ICMP echo reply, id 8430, seq 7, length 64

