This file contain packet data information send by ping command from another machine.

Command : sudo tcpdump -i any icmp >> tcpdump.txt
Command from other Machine: ping <ip address of this machine>

03:52:42.125245 IP arun-VirtualBox > arun-VirtualBox: ICMP echo request, id 8461, seq 1, length 64
03:52:42.125257 IP arun-VirtualBox > arun-VirtualBox: ICMP echo reply, id 8461, seq 1, length 64
03:52:43.128718 IP arun-VirtualBox > arun-VirtualBox: ICMP echo request, id 8461, seq 2, length 64
03:52:43.128745 IP arun-VirtualBox > arun-VirtualBox: ICMP echo reply, id 8461, seq 2, length 64
03:52:44.159968 IP arun-VirtualBox > arun-VirtualBox: ICMP echo request, id 8461, seq 3, length 64
03:52:44.159986 IP arun-VirtualBox > arun-VirtualBox: ICMP echo reply, id 8461, seq 3, length 64
03:52:45.182424 IP arun-VirtualBox > arun-VirtualBox: ICMP echo request, id 8461, seq 4, length 64
03:52:45.182442 IP arun-VirtualBox > arun-VirtualBox: ICMP echo reply, id 8461, seq 4, length 64
03:52:46.227115 IP arun-VirtualBox > arun-VirtualBox: ICMP echo request, id 8461, seq 5, length 64
03:52:46.227137 IP arun-VirtualBox > arun-VirtualBox: ICMP echo reply, id 8461, seq 5, length 64
03:52:47.258668 IP arun-VirtualBox > arun-VirtualBox: ICMP echo request, id 8461, seq 6, length 64
03:52:47.258691 IP arun-VirtualBox > arun-VirtualBox: ICMP echo reply, id 8461, seq 6, length 64
03:52:48.280686 IP arun-VirtualBox > arun-VirtualBox: ICMP echo request, id 8461, seq 7, length 64
03:52:48.280701 IP arun-VirtualBox > arun-VirtualBox: ICMP echo reply, id 8461, seq 7, length 64
03:52:49.307184 IP arun-VirtualBox > arun-VirtualBox: ICMP echo request, id 8461, seq 8, length 64
03:52:49.307206 IP arun-VirtualBox > arun-VirtualBox: ICMP echo reply, id 8461, seq 8, length 64
03:52:50.328996 IP arun-VirtualBox > arun-VirtualBox: ICMP echo request, id 8461, seq 9, length 64
03:52:50.329020 IP arun-VirtualBox > arun-VirtualBox: ICMP echo reply, id 8461, seq 9, length 64
03:52:51.352669 IP arun-VirtualBox > arun-VirtualBox: ICMP echo request, id 8461, seq 10, length 64
03:52:51.352684 IP arun-VirtualBox > arun-VirtualBox: ICMP echo reply, id 8461, seq 10, length 64
03:52:52.399903 IP arun-VirtualBox > arun-VirtualBox: ICMP echo request, id 8461, seq 11, length 64
03:52:52.399932 IP arun-VirtualBox > arun-VirtualBox: ICMP echo reply, id 8461, seq 11, length 64
03:52:53.433220 IP arun-VirtualBox > arun-VirtualBox: ICMP echo request, id 8461, seq 12, length 64
03:52:53.433248 IP arun-VirtualBox > arun-VirtualBox: ICMP echo reply, id 8461, seq 12, length 64
03:52:54.461924 IP arun-VirtualBox > arun-VirtualBox: ICMP echo request, id 8461, seq 13, length 64
03:52:54.461951 IP arun-VirtualBox > arun-VirtualBox: ICMP echo reply, id 8461, seq 13, length 64
03:52:55.484129 IP arun-VirtualBox > arun-VirtualBox: ICMP echo request, id 8461, seq 14, length 64
03:52:55.484156 IP arun-VirtualBox > arun-VirtualBox: ICMP echo reply, id 8461, seq 14, length 64
03:52:56.511706 IP arun-VirtualBox > arun-VirtualBox: ICMP echo request, id 8461, seq 15, length 64
03:52:56.511734 IP arun-VirtualBox > arun-VirtualBox: ICMP echo reply, id 8461, seq 15, length 64
03:52:57.532558 IP arun-VirtualBox > arun-VirtualBox: ICMP echo request, id 8461, seq 16, length 64
03:52:57.532585 IP arun-VirtualBox > arun-VirtualBox: ICMP echo reply, id 8461, seq 16, length 64
03:52:58.607167 IP arun-VirtualBox > arun-VirtualBox: ICMP echo request, id 8461, seq 17, length 64
03:52:58.607195 IP arun-VirtualBox > arun-VirtualBox: ICMP echo reply, id 8461, seq 17, length 64
03:52:59.616276 IP arun-VirtualBox > arun-VirtualBox: ICMP echo request, id 8461, seq 18, length 64
03:52:59.616303 IP arun-VirtualBox > arun-VirtualBox: ICMP echo reply, id 8461, seq 18, length 64
03:53:00.634209 IP arun-VirtualBox > arun-VirtualBox: ICMP echo request, id 8461, seq 19, length 64
03:53:00.634236 IP arun-VirtualBox > arun-VirtualBox: ICMP echo reply, id 8461, seq 19, length 64
03:53:01.656563 IP arun-VirtualBox > arun-VirtualBox: ICMP echo request, id 8461, seq 20, length 64
03:53:01.656591 IP arun-VirtualBox > arun-VirtualBox: ICMP echo reply, id 8461, seq 20, length 64
03:53:02.680139 IP arun-VirtualBox > arun-VirtualBox: ICMP echo request, id 8461, seq 21, length 64
03:53:02.680176 IP arun-VirtualBox > arun-VirtualBox: ICMP echo reply, id 8461, seq 21, length 64
03:53:03.704172 IP arun-VirtualBox > arun-VirtualBox: ICMP echo request, id 8461, seq 22, length 64
03:53:03.704200 IP arun-VirtualBox > arun-VirtualBox: ICMP echo reply, id 8461, seq 22, length 64
03:53:04.728544 IP arun-VirtualBox > arun-VirtualBox: ICMP echo request, id 8461, seq 23, length 64
03:53:04.728571 IP arun-VirtualBox > arun-VirtualBox: ICMP echo reply, id 8461, seq 23, length 64
03:53:05.774707 IP arun-VirtualBox > arun-VirtualBox: ICMP echo request, id 8461, seq 24, length 64
03:53:05.774735 IP arun-VirtualBox > arun-VirtualBox: ICMP echo reply, id 8461, seq 24, length 64
03:53:06.855301 IP arun-VirtualBox > arun-VirtualBox: ICMP echo request, id 8461, seq 25, length 64
03:53:06.855328 IP arun-VirtualBox > arun-VirtualBox: ICMP echo reply, id 8461, seq 25, length 64
03:53:07.919352 IP arun-VirtualBox > arun-VirtualBox: ICMP echo request, id 8461, seq 26, length 64
03:53:07.919380 IP arun-VirtualBox > arun-VirtualBox: ICMP echo reply, id 8461, seq 26, length 64
03:53:08.921164 IP arun-VirtualBox > arun-VirtualBox: ICMP echo request, id 8461, seq 27, length 64
03:53:08.921200 IP arun-VirtualBox > arun-VirtualBox: ICMP echo reply, id 8461, seq 27, length 64
03:53:09.958604 IP arun-VirtualBox > arun-VirtualBox: ICMP echo request, id 8461, seq 28, length 64
03:53:09.958632 IP arun-VirtualBox > arun-VirtualBox: ICMP echo reply, id 8461, seq 28, length 64
03:53:11.049371 IP arun-VirtualBox > arun-VirtualBox: ICMP echo request, id 8461, seq 29, length 64
03:53:11.049399 IP arun-VirtualBox > arun-VirtualBox: ICMP echo reply, id 8461, seq 29, length 64
03:53:12.056545 IP arun-VirtualBox > arun-VirtualBox: ICMP echo request, id 8461, seq 30, length 64
03:53:12.056573 IP arun-VirtualBox > arun-VirtualBox: ICMP echo reply, id 8461, seq 30, length 64
03:53:13.080137 IP arun-VirtualBox > arun-VirtualBox: ICMP echo request, id 8461, seq 31, length 64
03:53:13.080164 IP arun-VirtualBox > arun-VirtualBox: ICMP echo reply, id 8461, seq 31, length 64
03:53:14.104992 IP arun-VirtualBox > arun-VirtualBox: ICMP echo request, id 8461, seq 32, length 64
03:53:14.105020 IP arun-VirtualBox > arun-VirtualBox: ICMP echo reply, id 8461, seq 32, length 64
03:53:15.128283 IP arun-VirtualBox > arun-VirtualBox: ICMP echo request, id 8461, seq 33, length 64
03:53:15.128311 IP arun-VirtualBox > arun-VirtualBox: ICMP echo reply, id 8461, seq 33, length 64
03:53:16.152508 IP arun-VirtualBox > arun-VirtualBox: ICMP echo request, id 8461, seq 34, length 64
03:53:16.152541 IP arun-VirtualBox > arun-VirtualBox: ICMP echo reply, id 8461, seq 34, length 64
03:53:17.176287 IP arun-VirtualBox > arun-VirtualBox: ICMP echo request, id 8461, seq 35, length 64
03:53:17.176302 IP arun-VirtualBox > arun-VirtualBox: ICMP echo reply, id 8461, seq 35, length 64
03:53:18.202267 IP arun-VirtualBox > arun-VirtualBox: ICMP echo request, id 8461, seq 36, length 64
03:53:18.202294 IP arun-VirtualBox > arun-VirtualBox: ICMP echo reply, id 8461, seq 36, length 64
03:53:19.224394 IP arun-VirtualBox > arun-VirtualBox: ICMP echo request, id 8461, seq 37, length 64
03:53:19.224411 IP arun-VirtualBox > arun-VirtualBox: ICMP echo reply, id 8461, seq 37, length 64
03:53:20.257268 IP arun-VirtualBox > arun-VirtualBox: ICMP echo request, id 8461, seq 38, length 64
03:53:20.257286 IP arun-VirtualBox > arun-VirtualBox: ICMP echo reply, id 8461, seq 38, length 64

